{
  "$schema": "https://json-schema.org/draft/2020-12/schema",
  "title": "PlaybackTicketCreateRequest",
  "description": "Creates a playback ticket for a file bound to the authenticated device. Source locations, source headers, transport modes, burn options, and force switches are not request inputs.",
  "type": "object",
  "additionalProperties": false,
  "required": [
    "file_id",
    "device_id",
    "client",
    "preferred_transports"
  ],
  "properties": {
    "file_id": {
      "type": "integer",
      "minimum": 1
    },
    "device_id": {
      "type": "string",
      "pattern": "^dev_[A-Za-z0-9_-]{8,96}$",
      "description": "Consistency check only. The authenticated device access token remains the identity source."
    },
    "client": {
      "$ref": "playback-client-capabilities.schema.json"
    },
    "preferred_transports": {
      "type": "array",
      "minItems": 1,
      "maxItems": 4,
      "uniqueItems": true,
      "items": {
        "$ref": "playback-transport-kind.schema.json"
      },
      "description": "May reorder eligible v1 transports. It cannot add eligibility, enable direct-dash without the matching client capability, or force a disabled transport."
    }
  }
}
